{
  "manifest_version": "0.2",
  "pilot_phase": "CALIBRATION_10",
  "status": "READY",
  "approved_delta": "VOICE-20261007-18",
  "source_root": "https://drive.google.com/drive/folders/15XFoL6qBDi0RtfypixtfMgzFSypUhwn1",
  "gold_bundle": {
    "gold_type": "RECOVERED_APPROVED_CORE",
    "recovery_version": "0.1",
    "commit_sha": "ae9d80c409c2d3ed99ef30157ebe80a3bb918d04",
    "raw_url": "https://raw.githubusercontent.com/ohisamaconnect/ohisama-connect-system/ae9d80c409c2d3ed99ef30157ebe80a3bb918d04/member_voices/eval/CALIBRATION_10_RECOVERED_GOLD_v0.1.json",
    "sha256": "029b95ea134ecee0e63adc137cd744a064902eab2e7b888bd683510312464682",
    "full_artifact_v1_1_recovered": false,
    "evaluation_scope": [
      "CASE_IDENTITY",
      "SOURCE_SPEAKER_RETURNABILITY",
      "ACCEPTED_VOICE_COUNT",
      "ZERO_VOICE_SAFETY",
      "BOUNDARY_CASE_HANDLING",
      "SEMANTIC_CORE_HUMAN_AUDIT",
      "VOICE_COUNT_STABILITY"
    ]
  },
  "cases": [
    {
      "case_no": 1,
      "article_id": "25481",
      "expected_speaker": "小坂菜緒",
      "local_dir": "BLOG/小坂菜緒/2018/2018-06-23_25481_5869488c",
      "original_url": "https://www.hinatazaka46.com/s/official/diary/detail/25481",
      "published_at": "2018-06-23T22:14:00+09:00",
      "spoken_at": null,
      "relation_context": {},
      "comparison_context": [],
      "article_text_drive_file_id": "19EYrs9dFz5ADgRfdOhq8BlYB_unAWOmI",
      "metadata_drive_file_id": "17-SxZXnhsKtg2BJnd97hK0qMa1WSjlYU",
      "article_sha256": "3d9e43f56950741f4e8e5fb6f570f591b444ea788111d6e607494366fe7d2a9f",
      "gold_case_key": "25481",
      "expected_accepted_voice_count": 2,
      "boundary_review_expected": false,
      "gold_status": "RECOVERED_APPROVED_CORE"
    },
    {
      "case_no": 2,
      "article_id": "26676",
      "expected_speaker": "松田好花",
      "local_dir": "BLOG/松田好花/2018/2018-11-08_26676_0ce09743",
      "original_url": "https://www.hinatazaka46.com/s/official/diary/detail/26676",
      "published_at": "2018-11-08T06:53:00+09:00",
      "spoken_at": null,
      "relation_context": {},
      "comparison_context": [],
      "article_text_drive_file_id": "1pqCk-AFSVYiBenXde4d2KyTm0X7jC58E",
      "metadata_drive_file_id": "1G_KU5yf2SJwUKv4cR2805niYBKc4N38p",
      "article_sha256": "169cf19ce0d8302a7b3253d5d17646ed5cf539f2c57b9e19735c187469c1e222",
      "gold_case_key": "26676",
      "expected_accepted_voice_count": 0,
      "boundary_review_expected": false,
      "gold_status": "RECOVERED_APPROVED_CORE"
    },
    {
      "case_no": 3,
      "article_id": "33683",
      "expected_speaker": "松田好花",
      "local_dir": "BLOG/松田好花/2020/2020-05-07_33683_d6661642",
      "original_url": "https://www.hinatazaka46.com/s/official/diary/detail/33683",
      "published_at": "2020-05-07T00:19:00+09:00",
      "spoken_at": null,
      "relation_context": {},
      "comparison_context": [],
      "article_text_drive_file_id": "1qjeeUFCEvC-obs2L_oyQopAMjljAA4qe",
      "metadata_drive_file_id": "1psgoN54xP4dPZTtYNcZym1vFwMdtkrbW",
      "article_sha256": "204c90a9ad35dec6e20a78d88ada688c58bbab78f956e273a445e930c0d3ab78",
      "gold_case_key": "33683",
      "expected_accepted_voice_count": 1,
      "boundary_review_expected": false,
      "gold_status": "RECOVERED_APPROVED_CORE"
    },
    {
      "case_no": 4,
      "article_id": "35133",
      "expected_speaker": "小坂菜緒",
      "local_dir": "BLOG/小坂菜緒/2020/2020-08-11_35133_bacc653f",
      "original_url": "https://www.hinatazaka46.com/s/official/diary/detail/35133",
      "published_at": "2020-08-11T23:36:00+09:00",
      "spoken_at": null,
      "relation_context": {},
      "comparison_context": [],
      "article_text_drive_file_id": "1OzSgpSUKpWfH9CUmb3vHlwFr2x_iKoZj",
      "metadata_drive_file_id": "1xfCYBf3U0FEpt5j5K5eR3VMCZelpGlCX",
      "article_sha256": "5da9dc2895168cbedc69312b0f4b5db147425247212acf6d947efae24b4222d1",
      "gold_case_key": "35133",
      "expected_accepted_voice_count": 3,
      "boundary_review_expected": false,
      "gold_status": "RECOVERED_APPROVED_CORE"
    },
    {
      "case_no": 5,
      "article_id": "65922",
      "expected_speaker": "大田美月",
      "local_dir": "BLOG/大田美月/2025/2025-10-01_65922_dbf335ce",
      "original_url": "https://www.hinatazaka46.com/s/official/diary/detail/65922",
      "published_at": "2025-10-01T09:51:00+09:00",
      "spoken_at": null,
      "relation_context": {},
      "comparison_context": [],
      "article_text_drive_file_id": "1PFWbpO4PlLjPQ7JJAYMCDkcSt5WPZoE6",
      "metadata_drive_file_id": "1CVEjqhfusv-TYSk0mPYDdEAQAMoGocAv",
      "article_sha256": "03f00076235557186449c82024db4987ad07dff9468534f726a37f099c66d7a4",
      "gold_case_key": "65922",
      "expected_accepted_voice_count": 3,
      "boundary_review_expected": false,
      "gold_status": "RECOVERED_APPROVED_CORE"
    },
    {
      "case_no": 6,
      "article_id": "67706",
      "expected_speaker": "大田美月",
      "local_dir": "BLOG/大田美月/2026/2026-01-27_67706_b7c24683",
      "original_url": "https://www.hinatazaka46.com/s/official/diary/detail/67706",
      "published_at": "2026-01-27T19:49:00+09:00",
      "spoken_at": null,
      "relation_context": {},
      "comparison_context": [],
      "article_text_drive_file_id": "1F3JI-kESkKPqfOy7gb0zH0Mfyob_nCqM",
      "metadata_drive_file_id": "1s6KFZzXq_opXsLFN55LwqRUXdof8SP_O",
      "article_sha256": "54e2f5b5dff18a788e70df303219d1b4ec0040a305f8d5f8a324347167291f82",
      "gold_case_key": "67706",
      "expected_accepted_voice_count": 2,
      "boundary_review_expected": false,
      "gold_status": "RECOVERED_APPROVED_CORE"
    },
    {
      "case_no": 7,
      "article_id": "50967",
      "expected_speaker": "上村ひなの",
      "local_dir": "BLOG/上村ひなの/2023/2023-07-18_50967_ab95a94d",
      "original_url": "https://www.hinatazaka46.com/s/official/diary/detail/50967",
      "published_at": "2023-07-18T11:17:00+09:00",
      "spoken_at": null,
      "relation_context": {},
      "comparison_context": [],
      "article_text_drive_file_id": "11yWPQBMauz2nZF3iHkBJDcBpNDAlkSps",
      "metadata_drive_file_id": "1yhi-EpG3tl5mCETdXdM7x4bf2AIQdPsa",
      "article_sha256": "f62c9286f2f6136aba663f4066824ea8d42a2b4c5c5bbffa6cc390426e5c8fd3",
      "gold_case_key": "50967",
      "expected_accepted_voice_count": 2,
      "boundary_review_expected": true,
      "gold_status": "RECOVERED_APPROVED_CORE"
    },
    {
      "case_no": 8,
      "article_id": "55209",
      "expected_speaker": "金村美玖",
      "local_dir": "BLOG/金村美玖/2024/2024-03-24_55209_67136bb4",
      "original_url": "https://www.hinatazaka46.com/s/official/diary/detail/55209",
      "published_at": "2024-03-24T13:18:00+09:00",
      "spoken_at": null,
      "relation_context": {},
      "comparison_context": [],
      "article_text_drive_file_id": "1a1fO6hhyhY9Gqs41hQ10Bl2wFx0dyVYb",
      "metadata_drive_file_id": "1XtTw2NDKzfkgGtuGlsgv0g99-0eHtkrm",
      "article_sha256": "0bf3ed2f2b7f5ef97cd63a73c1673d30244fcafee9473bedaab56c994f7df9c0",
      "gold_case_key": "55209",
      "expected_accepted_voice_count": 2,
      "boundary_review_expected": false,
      "gold_status": "RECOVERED_APPROVED_CORE"
    },
    {
      "case_no": 9,
      "article_id": "25939",
      "expected_speaker": "高本彩花",
      "local_dir": "BLOG/高本彩花/2018/2018-08-08_25939_a6ec994b",
      "original_url": "https://www.hinatazaka46.com/s/official/diary/detail/25939",
      "published_at": "2018-08-08T21:31:00+09:00",
      "spoken_at": null,
      "relation_context": {},
      "comparison_context": [],
      "article_text_drive_file_id": "1SHqoiuOyZ09poC_gAURL0EH0gPd5C2T4",
      "metadata_drive_file_id": "1lIMrHg2tHULbIVintbyljyul6JZV-x5L",
      "article_sha256": "63245f38d3b45b6f16c526d5515d5af94ab4de69fa8ce9dca6ec9690da208df9",
      "gold_case_key": "25939",
      "expected_accepted_voice_count": 2,
      "boundary_review_expected": false,
      "gold_status": "RECOVERED_APPROVED_CORE"
    },
    {
      "case_no": 10,
      "article_id": "44109",
      "expected_speaker": "山口陽世",
      "local_dir": "BLOG/山口陽世/2022/2022-05-31_44109_f453efd8",
      "original_url": "https://www.hinatazaka46.com/s/official/diary/detail/44109",
      "published_at": "2022-05-31T22:59:00+09:00",
      "spoken_at": null,
      "relation_context": {},
      "comparison_context": [],
      "article_text_drive_file_id": "11tFEMpVk5fQiIcUG8XlQc5oK0uQLTzlQ",
      "metadata_drive_file_id": "1Y7YEKUdrPe6CmAfZXLpxSROvltnyscN_",
      "article_sha256": "f675b9701d33ade4bc844dc60b216cb0835ea988a8fb46d611f9768cc12f3bc9",
      "gold_case_key": "44109",
      "expected_accepted_voice_count": 1,
      "boundary_review_expected": false,
      "gold_status": "RECOVERED_APPROVED_CORE"
    }
  ],
  "recovery_notes": [
    "Original Calibration 10 case identities were recovered; no replacement cases were selected.",
    "Archive source identities and article.txt SHA256 values were read back.",
    "Gold is recovered semantic core, not reconstructed full Artifact v1.1.",
    "Unrecovered structured fields are excluded from recovered-Calibration scoring."
  ]
}
